{
  "$defs": {
    "FipaCommunicativeActSourceTermModel": {
      "additionalProperties": false,
      "properties": {
        "concept_id": {
          "pattern": "^[a-z]+(?:-[a-z]+)*$",
          "title": "Concept Id",
          "type": "string"
        },
        "position": {
          "minimum": 1,
          "title": "Position",
          "type": "integer"
        }
      },
      "required": [
        "position",
        "concept_id"
      ],
      "title": "FipaCommunicativeActSourceTermModel",
      "type": "object"
    }
  },
  "$id": "https://openrae.github.io/rae/schemas/fipa-communicative-acts-source-v1.json",
  "$schema": "https://json-schema.org/draft/2020-12/schema",
  "additionalProperties": false,
  "properties": {
    "citation_urls": {
      "items": {
        "minLength": 1,
        "type": "string"
      },
      "minItems": 1,
      "title": "Citation Urls",
      "type": "array"
    },
    "communicative_acts": {
      "items": {
        "$ref": "#/$defs/FipaCommunicativeActSourceTermModel"
      },
      "minItems": 1,
      "title": "Communicative Acts",
      "type": "array"
    },
    "license_notice": {
      "minLength": 1,
      "title": "License Notice",
      "type": "string"
    },
    "license_url": {
      "minLength": 1,
      "title": "License Url",
      "type": "string"
    },
    "retrieved_at": {
      "pattern": "^\\d{4}-\\d{2}-\\d{2}$",
      "title": "Retrieved At",
      "type": "string"
    },
    "schema_version": {
      "const": "fipa-communicative-acts-source/v1",
      "default": "fipa-communicative-acts-source/v1",
      "title": "Schema Version",
      "type": "string"
    },
    "source_artifact_url": {
      "minLength": 1,
      "title": "Source Artifact Url",
      "type": "string"
    },
    "source_authority": {
      "const": "Foundation for Intelligent Physical Agents",
      "title": "Source Authority",
      "type": "string"
    },
    "source_digest": {
      "minLength": 1,
      "pattern": "^(?:sha256:[A-Fa-f0-9]{64}|sha384:[A-Fa-f0-9]{96}|sha512:[A-Fa-f0-9]{128}|blake3:[A-Fa-f0-9]{64})$",
      "title": "Source Digest",
      "type": "string"
    },
    "source_status": {
      "const": "Standard",
      "title": "Source Status",
      "type": "string"
    },
    "source_url": {
      "minLength": 1,
      "title": "Source Url",
      "type": "string"
    },
    "source_version": {
      "const": "SC00037J-2002-12-03",
      "title": "Source Version",
      "type": "string"
    }
  },
  "required": [
    "source_authority",
    "source_version",
    "source_status",
    "source_url",
    "source_artifact_url",
    "source_digest",
    "citation_urls",
    "retrieved_at",
    "license_url",
    "license_notice",
    "communicative_acts"
  ],
  "title": "FipaCommunicativeActsSourceModel",
  "type": "object"
}
